audiofile-686589410038_extracted,complete,"Los Gatos, California","Jackie from HERTZ calls Lisa to discuss a rental car authorized by State Farm. Lisa expresses interest in picking up the vehicle today, as she works close to the location. However, she is concerned about not having her driver's license on her due to a unique situation involving just having an identification card and a picture of her driver's license. The agent clarifies that a physical driver's license is necessary and suggests that Lisa contact the Los Gatos branch directly for more personalized assistance. Lisa is given the branch's direct number with instructions to press option 5 to reach them directly.",State Farm,same_day_urgent,completed,same_day_urgent,flexible,lack of physical driver's license,,Same day preference for picking up a car.,unsure,true,lack of physical driver's license,false,false,true,false,false,true,true,false,true,true,false,true,false,false,false,,false,,,,,false,false,false,false,false,,true,false,false,,false,false,,false,false,true,requirement for a physical license,true,some_experience,true,true,true,stressed,calm,false,false,false,true,true,true,true,clear,false,3,Contact the Los Gatos branch directly.|Use option 5 when calling the branch.|Inquire about rental possibilities under current documentation constraints.,medium,due to needing to make additional effort to resolve documentation issues and contact the branch directly.,parked
audiofile-686589412425_extracted,complete,"Coon Rapids, with reference to Caliber Collision in Maple Grove","Tiffany from Hertz called Jason to confirm and schedule an insurance replacement rental authorized by State Farm Insurance. They discussed updating Jason's information, and Jason requested a pick-up service from Caliber Collision in Maple Grove for the following day at 2:15 PM. Tiffany confirmed details, informed Jason of the need to call the location an hour prior to pick-up, and that he would need a valid driver’s license and a credit or debit card. The resolution was providing Jason with a reservation email, including all necessary information.",State Farm Insurance,scheduled_future,completed,Scheduled_future,flexible,,,Tomorrow at 2:15 PM.,scheduled,false,,true,false,true,false,false,false,false,false,true,true,true,false,false,false,false,,false,,,,,false,false,true,false,false,,false,false,false,,false,false,,false,false,false,,true,some_experience,false,false,false,stressed,calm,false,false,false,false,false,true,true,clear,false,3,Check reservation details in the email.|Call the rental location one hour before the scheduled pick-up.|Bring a valid driver’s license and credit/debit card.,low,The call was efficient with minimal requirements for the customer beyond verifying details and following straightforward instructions.,finalized
audiofile-686589418594_extracted,complete,"Apollo Alto, California 816 San Antonio Road","The agent from HERTZ, Tiffany, called customer Abby Taylor to inform her that State Farm has authorized her to get a rental vehicle from their Apollo Alto location. Tiffany confirmed Abby's contact information, the vehicle's make and model, and the repair shop. They discussed the timing for vehicle pickup, with Abby planning to pick it up after her 1 p.m. appointment the next day. Abby agreed to call the branch an hour before pickup. The agent confirmed the arrangements and sent details via email, leading to a complete and prepared setup for the rental.",State Farm,straight_through,completed,Straight_through,flexible,Confirming Abby's readiness|Plan to call an hour ahead,The requirement to call an hour ahead for vehicle preparation.,"After 2 p.m., following her appointment at 1 p.m. the next day.",scheduled,false,,true,false,false,false,false,false,false,false,true,true,true,true,false,false,false,,false,,,,,true,false,true,false,false,,false,false,false,,false,false,,false,false,false,,true,experienced,false,false,false,calm,calm,false,false,false,true,true,true,true,clear,false,3,Call the branch one hour before pickup.|Bring a valid driver's license and a credit or debit card.|Follow up after her repair appointment.,low,The setup process was straightforward with minimal effort required beyond usual rental procedures.,finalized
audiofile-686589422009_extracted,complete,"Houston, Texas at 12804 Gulf Freeway Street 600","Jackie from Hertz called Mario Alvarez to complete a rental reservation authorized by State Farm for a rental at the Houston location. They discussed the timing for vehicle pickup and confirmed personal and vehicle details. Mario preferred to pick up the vehicle the same day due to traffic concerns, but needed to call the branch in advance. Jackie offered to transfer Mario to the branch for further assistance on timing.",State Farm,same_day_urgent,completed,Same_day_urgent,urgent,timing and pickup procedures,"Branch closes at 5:30 PM, with the latest reservation time at 4:30 PM.",Desired to pick up the vehicle the same day.,immediate_same_day,true,,true,false,true,false,false,true,true,false,true,true,true,true,false,false,false,,false,,,,,true,false,true,false,false,,true,true,true,,false,false,,false,false,true,timing flexibility|branch reservation later than 4:30 PM,true,some_experience,false,false,true,anxious,anxious,false,true,false,true,true,true,true,partial,false,3,Call the branch and select option 5.|Confirm pickup timing with the branch.|Present documents at pickup.,medium,due to extra step of confirming details with the branch amidst urgency from traffic concerns.,parked
audiofile-686589424540_extracted,complete,Kansas City at 1E Pershing Road,"Tiffany from Hertz called Deborah Williams to inform her of the authorization from State Farm for a rental vehicle. They confirmed the damaged vehicle's details, established the use of Hendrick Automotive Center as the body shop, and discussed logistics for picking up the rental car. Deborah agreed to retrieve the rental around 12 pm the following day. Tiffany instructed Deborah to call the branch an hour before arrival and confirmed Deborah's contact details and preferences.",State Farm,,completed,straight_through,flexible,confirming the pickup time|logistics (ride or pickup service),The customer was advised to call the branch an hour prior to arrival.,Around 12 pm the following day.,scheduled,false,,true,false,true,false,false,false,false,false,true,true,true,true,false,false,false,,false,,,,,false,false,false,false,false,,false,false,false,,false,false,,false,false,false,,true,some_experience,false,false,false,stressed,calm,false,false,false,true,true,true,true,clear,false,2,Call the branch an hour before the scheduled pickup.|Bring a valid driver's license and a credit/debit card.,low,"The instructions were straightforward, and the self-pickup plan was feasible within the customer’s schedule.",finalized
audiofile-686589430713_extracted,complete,"2119 Airline Drive Suite 200 in Bozer City, Louisiana","Jackie from HERTZ contacted Mr. Bates to discuss a rental authorized by State Farm following the theft of his car. Jackie asked Mr. Bates about his vehicle needs and timing, offering to connect him with the local branch for specifics. Mr. Bates confirmed prior communication with a local branch, where he was informed about limited availability due to absent staff. He was advised of a possible pickup at 9 AM and discussed vehicle preferences (Sentra or Nissan Rogue). Mr. Bates appeared uncertain due to his inexperience with such rentals, but ultimately decided to adhere to the previously agreed-on pickup time of 9 AM the next morning.",State Farm,scheduled_future,completed,Scheduled_future,flexible,Timing of vehicle pickup.|Vehicle class preference.|Confirmation of email and phone details.,Branch closure at 6 PM.,Mr. Bates did not need a vehicle the same day; he agreed to a pickup the following morning at 9 AM.,scheduled,false,,true,false,true,false,true,false,true,false,false,false,true,,true,true,false,,false,,,Sentra or Nissan Rogue.,,false,false,false,false,false,,false,false,false,,false,false,,false,false,true,The process and coordination between locations.,false,first_time,false,false,false,calm,calm,false,false,true,true,true,true,true,clear,false,2,Attend scheduled pickup.|Possibly reconfirm details closer to time with the branch.,medium,Due to newness to the process and reliance on coordination with external parties.,finalized
audiofile-686589454664_extracted,complete,"Silver Spring, Maryland at 8000 Georgia Ave","Jackie from Hertz contacted the customer, Jose, to complete a rental reservation authorized by State Farm. Jose needed language assistance, leading to a translator being involved. The customer recently had a car accident, was hospitalized, and uncertain about when he would need the rental since he’s unsure about returning to work. His car hadn’t been sent to a repair shop yet. The call concluded with Hertz suggesting that once Jose is ready, he can schedule the rental pickup directly with the branch.",State Farm,parked_waiting_on_third_party,parked,"Parked, waiting on the third party",flexible,Request for language assistance|Providing customer details including vehicle information|Discussion of accident and current hospital situation|Suggestion to schedule rental at a later time,,Undetermined due to being hospitalized after an accident.,,false,,,false,true,false,false,false,false,false,true,false,false,false,false,false,false,The customer was hospitalized following an accident.,true,medical,,,,,,,false,false,,false,false,false,,false,false,,false,false,false,,false,,false,false,true,anxious,anxious,false,true,true,true,true,true,true,clear,false,3,Recover from injuries.|Decide on the timing for rental.|Contact the branch to schedule rental pickup.,medium,"The customer has to manage hospital recovery, timing uncertainty, and logistics with the branch later.",parked
audiofile-686589470038_extracted,complete,410 Westridge Pike,"Jackie from Hertz called Norman Claiborne to complete a rental reservation authorized by State Farm due to a damaged vehicle. Norman intends to pick up the rental tomorrow morning around 8 or 9 a.m. Jackie confirmed the reservation and instructed Norman to call the branch an hour in advance using an automated system to ensure the car is ready. Norman confirmed details such as email, cell phone number, and the details of the damaged vehicle (2019 Infinity Q60) but did not require pickup service from Hertz. Jackie explained the branch is currently closed and provided instructions for when Norman should call.",State Farm,straight_through,completed,The call flowed smoothly with few decision points.,urgent,confirmation of personal information|preferred pickup time|decision against needing pickup service,Branch currently closed; call an hour in advance for inventory confirmation.,Pick up at 8 or 9 a.m. the next morning.,scheduled,false,,true,false,false,false,false,false,false,false,true,true,false,true,false,true,false,,false,,,,,false,,,false,false,,true,false,false,false,true,false,,false,false,false,,true,some_experience,false,false,false,calm,calm,false,false,false,true,true,true,true,clear,false,3,Call the branch at least an hour before pickup.|Press option 5 to speak directly with the desk staff.|Present a valid driver's license and debit/credit card upon pickup.,low,The process was straightforward with clear instructions and no additional complications introduced.,finalized
audiofile-686589478003_extracted,complete,"Brooklyn Center, Minnesota at 6201 Brooklyn Boulevard","Jackie Collins from HERTZ called Mary to confirm details for a rental vehicle authorized by State Farm due to front bumper damage on Mary's 2018 Toyota RAV4. The rental is to be picked up from the HERTZ branch in Brooklyn Center. Mary confirmed personal details and the repair shop location, and requested to initially pick up the vehicle between 3:30 to 4:00 p.m. on November 4th. The agent instructed Mary to call the branch an hour in advance to ensure the vehicle is ready. Mary later requested to change the pickup time to 11:00 a.m., which the agent accommodated. Mary was advised to call the branch before 11:00 a.m. to confirm.",State Farm,straight_through,completed,straight_through,flexible,initial confirmation for 3:30 to 4:00 p.m. rental pickup|change to 11:00 a.m.,Branch opens at 8:00 a.m.,"Initially requested for November 4th between 3:30 and 4:00 p.m., then changed to 11:00 a.m. the same day.",scheduled,false,,true,false,false,false,false,false,false,false,true,true,true,true,false,false,false,,false,,,,,,false,,false,false,,false,false,false,,false,false,,false,false,false,,true,some_experience,false,false,false,calm,calm,false,false,false,true,true,true,true,clear,false,2,Call the branch before 11:00 a.m.|Present a valid driver's license and a debit/credit card upon vehicle pickup.,low,"The customer only needed to adjust the pickup time and make a confirmation call, with clear instructions provided.",finalized
audiofile-686589553586_extracted,complete,"Mishawaki, 317 East McKinley","Tiffany from Hertz called Tiana Miller regarding an insurance replacement rental authorized by State Farm Insurance at the Mishawaki location. Tiffany intended to update Tiana's information and possibly schedule the rental. However, Tiana was not ready to schedule the rental as she was waiting to hear back from the auto shop about when they will receive her damaged car. The call ended with Tiffany noting that Tiana would call back when ready to schedule.",State Farm Insurance,scheduled_future,completed,scheduled_future,flexible,confirming the preferred contact number|determining the auto shop name and contact,,waiting for a confirmation from the auto shop about when they could take her car,unsure,false,,true,false,false,false,false,false,false,,false,false,,,false,false,false,,false,,,replacement rental vehicle,,,,,false,false,,false,false,false,,false,false,,false,false,false,,true,some_experience,false,false,false,calm,calm,false,false,false,true,true,true,true,clear,false,2,confirm details with the auto shop|call back with the necessary information,low,"because Tiana only needs to complete a follow-up action with her own scheduling flexibility, and no significant barriers to completion were mentioned.",provisional
audiofile-686589557096_extracted,complete,"Kiss Me, Florida, at 715 East Vine Street","Tiffany from Hertz called Maria Moran-Diaz regarding an insurance replacement rental authorized by State Farm Insurance. The rental is to be scheduled for pickup in Kiss Me, Florida. Maria confirmed the need for the rental for the following day and provided details of her damaged vehicle and her body shop appointment. Tiffany confirmed pickup arrangements from the repair shop and sent a reservation email to Maria. Maria confirmed receipt of the email, and the call concluded with all arrangements set for the next day.",State Farm Insurance,scheduled_future,completed,Scheduled_future,flexible,confirmation of scheduling|vehicle details|pickup arrangements,,Needed the rental for the following day.,scheduled,false,,true,false,false,false,false,false,false,false,true,true,true,false,false,false,false,,false,,,,,true,false,true,false,false,,false,false,false,,false,false,,false,false,false,,true,some_experience,false,true,false,stressed,calm,false,false,false,true,true,true,true,clear,false,2,Call the branch directly and select option five for assistance.|Ensure having a valid driver’s license and a credit or debit card for rental pickup.,low,"The process was straightforward, organized, and met the customer’s needs without complication.",finalized
audiofile-686752860112_extracted,complete,"5717 S I-35 in Austin, Texas","Nathaniel Ruttinger received a call from a Hertz representative regarding a rental car authorized by State Farm. The discussion covered scheduling and confirming a vehicle delivery time, either for that day or the evenings throughout the week. The customer preferred delivery but agreed to pick up if necessary. The agent attempted to confirm delivery with the branch but was unable to reach them. An escalation form was sent so the area manager could call back to confirm a delivery time. The call concluded with the customer satisfied that further follow-up would occur.",State Farm,parked_waiting_on_third_party,parked,Parked_waiting_on_third_party,flexible,whether the customer preferred delivery or pickup|attempting to reach the branch to confirm delivery,,Preferred delivery any time that day or pickup in the evenings.,unsure,false,,true,false,true,true,false,false,false,true,false,false,false,false,false,false,false,,false,,,similar to a Honda CRV,,,,,false,false,,true,true,false,false,true,false,,false,false,false,,true,some_experience,true,false,false,stressed,calm,false,false,false,true,true,true,true,clear,false,1,Await contact from the Hertz area manager.,low,The customer provided necessary information but did not need to engage in extensive follow-up. The burden of action shifted to Hertz to confirm delivery.,finalized
audiofile-686752869865_extracted,complete,"2741 Paxton Street in Harrisburg, PA","The customer, who had an accident involving hitting a deer, received a call from Lucian at Hertz regarding a rental car reservation made by State Farm. The customer plans to take their vehicle for evaluation and will set up a rental once repair dates are confirmed. The customer requested an intermediate-sized vehicle and wanted to avoid Jeep or Chrysler brands due to size concerns. The call concluded with plans for the customer to follow up once more information is available about their repair schedule.",State Farm,,completed,straight_through,flexible,,,The customer needed to wait until their car was evaluated before scheduling the rental.,,false,,true,false,true,false,false,false,false,false,false,false,false,true,true,true,true,,false,,,Intermediate-sized class,,false,false,false,false,false,,false,false,false,,false,false,,false,false,false,,true,,false,false,false,calm,calm,false,false,false,true,true,true,true,clear,false,1,call back once they have a date and time for the rental,low,"The process was straightforward, and the customer was clear on needing to follow up.",finalized
audiofile-686752875064_extracted,complete,"126 FM 1960 in Houston, Texas","The conversation was between Lucian from Hertz and a customer regarding a rental authorization provided by State Farm. The representative called to coordinate the pickup of the rental vehicle. The customer intended to pick up the car the same day and was inquiring about the security deposit requirement. The customer faced a problem with their driver's license, which had been stolen. They had digital proof and a passport as identification alternatives. Lucian advised coordinating with the location for potential workarounds. The customer required a pickup from their home at 2:30 PM. There were discussions about contact details and vehicle information, concluding with Lucian updating the reservation and attempting to confirm details with the branch.",State Farm,straight_through,completed,straight_through,urgent,Inquiry about security deposit and payment method.|Issue with lack of physical driver's license.|Coordination for pickup.,,Same-day pickup.,immediate_same_day,true,,true,false,true,false,false,true,false,false,false,false,true,,false,false,false,,false,,,,$50 to $200,true,true,true,false,false,$50 to $200,true,true,false,,false,false,,false,false,false,,true,some_experience,false,false,false,stressed,calm,false,false,false,true,true,true,true,partial,false,2,"Provide identification, as discussed, when picking up the vehicle.|Possibly await confirmation from the branch regarding ID acceptance.",medium,The customer needs branch confirmation and must coordinate logistically for pickup.,finalized
audiofile-686752897984_extracted,complete,"San Antonio, Texas","The call was between Lyric from HERTZ and a customer, Jonathan, regarding a rental car authorized by State Farm. The rental details were confirmed for a HERTZ location in San Antonio, Texas. Jonathan confirmed the need for a pickup from a collision center and mentioned his appointment was at 8 a.m. the next day. Details about the vehicle in question, a 2013 Chevrolet Silverado, were confirmed, and Jonathan was advised to contact the branch prior to arriving. Pickup truck reservations were confirmed.",State Farm,straight_through,completed,Straight_through,urgent,Confirmation of the rental location.|Timing of the ride pickup and opening hours.|Specification of vehicle type and confirmation of details.,Branch opens at 8 a.m.; earliest pickup at 9 a.m.,Appointment at 8 a.m. the next day.,immediate_same_day,false,Conflict with opening hours.,false,false,true,false,false,false,false,false,true,false,true,false,false,false,false,,false,,,Pickup truck,,,,,false,false,,false,false,false,,false,false,,false,false,false,,true,experienced,false,false,false,stressed,calm,false,false,false,true,true,true,true,clear,false,3,Opt to take an Uber.|Contact the HERTZ location prior to arrival.|Ensure possession of driver's license and credit/debit card.,low,The customer agreed with the plan and adjusted accordingly with clear next steps provided.,finalized
audiofile-686752898671_extracted,complete,"17330 Spring Cypress in Cypress, Texas","Jennifer from HERTZ calls Candace to update her on a rental car reservation authorized by FirstExcept. Candace confirms her personal details and mentions she will be driven to the location, not needing pickup. She plans to arrive by noon. Tying it to the repair shop I-CAR in Houston, Jennifer informs her about the incidental deposit ranging from $50 to $200, typically refunded upon return. Insurance specifics are noted as requiring branch inquiry. The call concludes without any unresolved concerns.",FirstExcept,straight_through,completed,Straight_through,urgent,repair shop information|understanding of insurance|deposit requirements,,Candace plans to be at the location by noon.,immediate_same_day,false,,true,false,true,false,false,false,false,false,true,true,false,true,false,false,false,,false,,,,,false,,false,false,false,$50 to $200,true,false,false,,false,false,,false,false,true,insurance details|deposit requirement,true,some_experience,false,false,false,calm,calm,false,false,false,true,true,true,true,clear,false,3,Arrive at the specified branch by noon.|Bring a valid driver's license and a debit/credit card.|Possibly call the branch for insurance specifics if needed.,low,Candace's effort was minimal with clear instructions and expectations provided.,finalized
audiofile-686752905817_extracted,complete,"Washington, Pennsylvania at 1000 Park Place Drive","The call is from Lyric at Hertz to Richard Baer regarding a State Farm-authorized rental. Richard plans to wait until his vehicle, a 2015 Ford F-150, goes in for repairs before renting. He provides his email and confirms Stewart's Collision Service in Uniontown, Pennsylvania, for repairs. Richard is advised to contact the local Hertz location an hour in advance when he figures out if he needs pickup or is going to the location himself, and to ensure he has a valid driver's license and credit card.",State Farm,scheduled_future,completed,Scheduled_future,flexible,,,Waiting until vehicle goes in for repairs.,unsure,false,,true,false,true,false,false,false,false,,true,true,,true,false,false,false,,false,,,,,true,false,true,false,false,,false,false,false,,false,false,,false,false,false,,true,some_experience,false,false,false,calm,calm,false,false,false,true,true,true,true,clear,false,2,Contact local Hertz an hour before pickup.|Ensure possession of a valid driver's license and credit or debit card upon arrival.,low,The customer has a clear understanding of the steps and no additional work or stress was implied.,provisional
audiofile-686752914558_extracted,complete,"3801 Collins Avenue in Miami Beach, Florida, and 229 Southeast 2nd Street in Miami, Florida.","The call involves a Hertz representative reaching out on behalf of State Farm to notify a customer about a rental reservation. The customer, Dianna, was trying to confirm the availability of a small or medium-sized car within the $50 coverage range. The customer faced difficulty contacting the branch directly and the Hertz agent couldn't confirm vehicle availability but attempted to contact the location, resulting in an error. The agent offered to escalate the issue for a callback and provided an alternative branch’s details for possible rental.",State Farm,parked_waiting_on_third_party,parked,Parked_waiting_on_third_party,urgent,Establishing contact with the Miami Beach branch.|Attempt to contact them by the agent.|Provision of alternative location information.|Decision on whether to visit the alternative branch.,,Immediate confirmation of vehicle availability.,immediate_same_day,true,phone issues with the Miami Beach branch,false,true,true,false,false,true,true,false,true,true,true,true,true,true,true,,false,,,Small to medium-sized vehicles.,$50,true,true,true,false,false,,false,true,false,false,true,false,,false,true,true,vehicle availability|contacting the branch,true,some_experience,true,false,true,calm,anxious,false,true,false,true,true,true,true,clear,false,2,Await a callback from the escalation.|Contact the alternative branch.,medium,"The customer had to manage additional tasks of contacting another branch and wait for a potential callback, adding to the effort to confirm availability.",parked
