audiofile-686587906554_extracted,complete,"Inglewood, California (address 140 East Tamarack Avenue)","The call involves Andrew from HERTZ speaking with a customer, Jeremy, about a rental car authorized by State Farm due to a repair need. Andrew explains that the rental must be picked up from a specific location as airport pickups incur out-of-pocket charges not covered by the insurance. Jeremy considers the timing for pickup and confirms contact details. Additional details about the repair shop and vehicle are discussed. Jeremy asks about contacting HERTZ in the future, to which Andrew advises on calling the location directly. The call ends amicably.",State Farm,straight_through,completed,Straight_through,flexible,,,Not immediately decided; Jeremy needed to think about it.,unsure,false,,true,false,false,false,true,false,false,false,true,true,true,true,false,false,false,,false,,,,,true,false,true,false,false,,false,false,false,,false,false,,false,false,false,,true,some_experience,false,false,false,calm,calm,false,false,false,true,true,true,true,clear,false,3,Decide the date and time for pickup|Call back or respond to email with the chosen pickup timing|Use option 5 for direct contact at the branch if needed,low,Jeremy only needs to decide timing and call or email to finalize details. The process was clearly explained.,provisional
audiofile-686587909225_extracted,complete,"Birmingham, Alabama, at 2508 5th Ave South","The conversation is between an agent from HERTZ and a customer whose car was involved in an accident. State Farm has authorized a rental, and the customer initially attempted to go through Enterprise but is now arranging a rental with HERTZ. The customer needs the rental as soon as possible since their car was taken to the shop. The agent confirms the earliest availability is Monday at 9 am, which the customer agrees to. The customer has just returned home and requests a pickup. They provide their email and phone number and share information about the damaged vehicle. The agent confirms receipt of this information and discusses providing shop contact details at Loud and Clear Customs for State Farm to track the car's repair status.",State Farm,scheduled_future,completed,Scheduled_future,urgent,confirming the pickup day and time|verifying the pickup from home,The vehicle could be picked up Monday at 9 am.,As soon as possible,immediate_same_day,true,,true,false,false,false,false,true,false,false,false,false,true,false,false,false,false,,false,,,,3rd to the 27th of the month,true,true,true,false,false,,false,false,false,,false,true,Enterprise,false,false,false,,true,some_experience,false,false,false,calm,anxious,false,false,false,true,true,true,true,clear,false,1,contact the repair shop to obtain and provide their contact number to HERTZ,medium,"The customer was required to provide additional information about the repair shop's contact number, but the rental process was otherwise smooth and resolved in a single call.",finalized
audiofile-686587936950_extracted,complete,"9904 South Southern Boulevard in Arroyo Palm Beach, Florida","TK from HERTZ calls Deborah Grant about her authorized vehicle rental with HERTZ through State Farm. The conversation revolves around confirming rental details and location. Deborah needs to check with the auto body shop to schedule her car repair before arranging the rental. TK provides contact information for future reference and offers to send details via email. Deborah confirms her email address and contact number. They discuss the repair shop location, the model of the damaged vehicle, and the possibility of Deborah calling back to schedule the rental.",State Farm,scheduled_future,parked,scheduled_future,flexible,confirmation of contact details|rental authorization|future actions needed,,"Uncertain, dependent on when the auto body shop schedules her repair.",unsure,false,,true,false,false,false,false,false,false,false,true,false,false,false,false,false,false,,false,,,similar class suitable for the existing Mercedes vehicle,,true,false,true,false,false,,false,false,false,,false,false,,false,false,false,,true,some_experience,false,true,false,calm,calm,false,false,false,true,true,true,true,clear,false,2,Call the auto body shop to schedule the repair.|Contact HERTZ to arrange the rental once repair timing is known.,medium,Deborah needs to coordinate between the repair shop and rental scheduling separately.,parked
audiofile-686587939281_extracted,complete,"Harvey, Louisiana (1950 Manhattan Boulevard)","Jackie from Hertz called Ms. Simmons to inform her that State Farm has authorized a rental car through Hertz at their branch in Harvey, Louisiana. Jackie was confirming Ms. Simmons' reservation details and insurance authorization for a rental vehicle due to a damaged 2009 Infiniti FX35. The rental would be ready on Monday at 9 am. Ms. Simmons confirmed her contact information and was reminded to call the branch an hour in advance. She should also present a valid driver's license and a debit or credit card upon pickup. The call concluded with Jackie confirming all details and Ms. Simmons indicating no further questions.",State Farm,,completed,straight_through,flexible,confirming the reservation date time|verifying contact information,earliest availability was Monday due to branch closure,by Monday,scheduled,false,,true,false,false,false,false,false,false,false,true,false,true,true,false,false,false,,false,,,,,true,false,true,false,false,,true,false,false,,false,false,,false,false,true,repair shop location,true,,false,false,false,calm,calm,false,false,false,false,false,true,true,clear,false,3,Call the Hertz branch an hour in advance.|Bring a valid driver's license.|Bring a debit or credit card.,low,"The customer only needed to call ahead and bring documentation, which is minimal effort.",finalized
audiofile-686587940117_extracted,complete,"4406 South Memorial, Tulsa, Oklahoma","The call involves a representative from Hertz and a customer discussing a vehicle rental authorized by State Farm. The customer verifies details, including their ability to get to the Hertz location with the help of a family member and settles on picking up the vehicle on Monday at 10 a.m. The representative confirms branch timings, discusses membership points, and explains payment processes, stating the insurance covers the cost but a deposit is required. The representative instructs the customer to call the branch an hour before the appointment for confirmation and assures that damage insurance is included.",State Farm,scheduled_future,completed,Scheduled_future,flexible,deciding on the pickup time for Monday|whether to include membership points|verifying payment details concerning State Farm's coverage,"Closed on weekends, open on Monday from 9 a.m. to 4 p.m.",Monday morning at around 10 a.m.,scheduled,false,,true,false,true,false,false,false,false,false,true,true,true,true,false,false,false,,false,,,,100%,true,false,true,false,false,$50,true,false,false,,false,false,,false,false,true,payment process,true,some_experience,true,false,false,stressed,calm,false,false,false,true,true,true,true,clear,false,2,Call the Hertz location one hour before pickup.|Bring a valid driver's license and a major debit or credit card.,low,The process was straightforward with clear instructions and minimal action required from the customer.,finalized
audiofile-686588513697_extracted,complete,"Tulsa, Oklahoma, 4406 South Memorial","The call is initiated by Mariah from HERTZ, confirming a rental authorized by State Farm Insurance for Janine McGuire. The rental is for the Tulsa location. Janine indicates she needs to speak with Gerber before setting up the rental timing. Mariah advises Janine to contact the local HERTZ location directly to finalize the reservation once Janine confirms her schedule with Gerber. Key topics include rental setup and the process for finalizing the rental. There is no final resolution within the call as Janine needs to follow up with external parties.",State Farm Insurance,scheduled_future,parked,scheduled_future,flexible,Need for Janine to contact Gerber,,,,false,,,false,true,false,false,false,false,false,true,true,true,,false,false,false,,false,,,,,false,false,false,false,false,,false,false,false,,false,false,,false,false,true,Whom to call back,true,,true,true,false,calm,calm,false,false,false,true,true,true,true,clear,false,2,Confirm details with Gerber|Call the local HERTZ branch using the provided number and select option 5,medium,The customer needs to coordinate with another party and contact the branch separately.,parked
audiofile-686588520422_extracted,complete,"Philadelphia, 4100 Presidential Boulevard and Esserton Avenue","The call involves Zariah from Hertz contacting Kyra Boyington regarding a rental car authorized by State Farm Insurance. Kyra expressed dissatisfaction with the Presidential Boulevard location due to prior bad experience and requested service from the Esserton Avenue location instead. Zariah checked for availability at the requested branch. Kyra required home pickup service, but Zariah stated it's not guaranteed and advised having an alternative plan. The reservation was updated to the Esserton Avenue location. Due to difficulties reaching the Hertz branch, an escalation was created, advising Kyra to keep trying or arrange alternative transportation if necessary.",State Farm Insurance,high_constraint_safety_sensitive,completed,high_constraint_safety_sensitive,flexible,switching locations|verifying pickup requirements|confirming insurance|resolving branch communication issues,,Same day at 12 o'clock.,immediate_same_day,true,,true,true,true,false,true,true,true,false,true,true,true,false,false,false,true,customer's physical condition post-accident,true,safety,suv_regular,SUV,,false,false,false,false,false,,false,true,false,false,true,false,,true,true,false,,true,some_experience,false,false,true,calm,frustrated,false,true,true,true,true,true,true,clear,false,2,attempt contacting the branch|have backup transportation method if pickup is unavailable,medium,"due to the need for further confirmations, multiple calls, potential for unplanned transportation arrangements, and addressing prior bad experiences",finalized
audiofile-686588544792_extracted,complete,"Memphis, Tennessee, 1831 Get Well Road","The call was between an agent from Hertz named Zariah and a customer named Mari Eaton. The conversation focused on arranging a rental car authorized by State Farm Insurance due to a damaged vehicle. Mari required a pickup service later in the day, which is subject to availability from the Hertz location. The agent clarified pickup service is at the location's discretion and provided instructions for ensuring confirmation. The call ended with the agent transferring Mari to a Hertz representative to confirm the pickup.",State Farm Insurance,scheduled_future,completed,Scheduled future,flexible,arranging a pickup|verifying email and address|disclosure about the conditional nature of the pickup service|need to contact the branch directly,Branch hours are 7:30 AM to 5:00 PM.,Pickup service needed by 1 PM.,near_term,true,,true,true,true,false,true,true,true,,true,true,true,,false,false,false,,false,,,,,true,false,true,false,false,,false,true,true,true,false,false,,false,false,true,Concern about the pickup not being confirmed timely.,true,some_experience,false,false,false,calm,calm,false,false,false,true,true,true,true,clear,false,2,Contact the branch to confirm pickup one hour before the scheduled time.|Present a valid driver's license and credit/debit card at the Hertz location.,medium,Due to needing to confirm pickup and logistics involved in reaching the branch if pickup is unavailable.,finalized
audiofile-686588559499_extracted,complete,"Cypress, Texas, 17330 Spring Cypress Suite 120","The caller, Zariah from HERTZ, contacts Jason regarding a State Farm-authorized rental in Cypress, Texas. Jason confirms he can reach the HERTZ location without needing a pickup. They discuss the timing for picking up the rental, settling on today at 1 PM. Verification of email, phone number, address, vehicle details (Toyota Tundra 2024), and repair shop location (Crash Champions on 249 in Tombaugh) follows. The call is briefly placed on hold, then resumed with instructions for Jason to contact the HERTZ location an hour prior to pickup.",State Farm Insurance,straight_through,completed,straight_through,urgent,,,Same day pickup at 1 PM.,immediate_same_day,false,,true,false,false,false,false,false,false,false,true,false,false,true,false,false,false,,false,,,,,,,,false,false,,false,false,false,,false,false,,false,false,false,,true,some_experience,false,false,false,calm,calm,false,false,false,true,true,true,true,clear,false,3,"Arrive at the HERTZ location today at 1 PM.|Call the HERTZ location an hour prior, using option 5 to confirm the pickup plan.|Present a valid driver's license and credit/debit card upon arrival.",low,"Instructions were clear, and no significant obstacles or changes were imposed on the customer.",finalized
audiofile-686588568280_extracted,complete,"HERTZ location at 911 West Anderson Lane, Suite 125, Austin, Texas","The call is from Zariah at HERTZ to Sharon regarding a car rental authorized by State Farm Insurance. The conversation involves confirming Sharon's ability to get to the HERTZ location, the date and time needed for the rental, personal details such as email, home address, phone number, and details of the damaged vehicle. Zariah confirms the reservation and informs Sharon about the necessary steps and documents required for pickup. Sharon does not have any further questions, and the call ends on a positive note.",State Farm Insurance,,completed,straight_through,flexible,,,12:30 (no specific date mentioned),,false,,true,false,false,false,false,false,false,false,true,true,true,true,false,false,false,,false,,,,,,false,,false,false,,true,false,false,,false,false,,false,false,false,,true,some_experience,false,false,false,calm,calm,false,false,false,false,false,true,true,clear,false,3,Present at the HERTZ location at the correct date and time.|Bring a valid driver’s license and a credit/debit card.|Call the specific HERTZ location an hour in advance and select option 5.,low,"Low, as all necessary information was communicated clearly and there were no additional obstacles or complexities.",finalized
audiofile-686588577252_extracted,complete,"Houston, Texas, 126 FM 1960 E Suite A","The call was conducted between Gabrielle Bielski and Mariah, a representative from the HERTZ call center. The representative informed Gabrielle about an authorized rental from HERTZ by State Farm Insurance. Gabrielle inquired about the possibility and cost of delivery for the rental vehicle.",State Farm Insurance,,completed,straight_through,flexible,The delivery not being guaranteed|The need to confirm with the local branch,,"Gabrielle mentioned she would visit to have her car looked at around 10 or 11 o'clock, but had not completed that yet.",unsure,false,,true,false,true,true,false,false,true,true,true,false,false,false,false,false,false,,false,,,,,false,false,true,false,false,,false,false,false,,false,false,,false,false,true,the delivery guarantee|the logistics,true,some_experience,true,true,false,stressed,calm,false,false,false,true,true,true,true,clear,false,2,Determine the date and time she needs the rental.|Contact the local HERTZ branch to confirm rental and delivery details.,medium,"Gabrielle needs to follow up with the local branch to finalize details and confirm delivery, which adds steps to her process.",provisional
audiofile-686588583714_extracted,complete,"Houston, Texas","The conversation is between a representative from HERTZ, named Aria, and a customer named Perkins. Aria is calling to confirm details for a vehicle rental authorized by State Farm Insurance in Houston, Texas. The customer provides personal information such as their email, home address, phone number, and details about their damaged vehicle (a 2023 Hyundai Tucson). They also confirm that they will be able to go to the HERTZ location on Wednesday morning for a 9 AM pickup. The call concludes with confirmation of these details and a courteous farewell.",State Farm Insurance,straight_through,completed,straight_through,flexible,,,Wednesday morning at 9 AM,scheduled,false,,true,false,false,false,false,false,true,false,false,false,true,true,false,false,false,,false,,,,,,false,,false,false,,false,false,false,,false,false,,false,false,true,location access,true,some_experience,false,false,false,calm,stressed,false,false,false,false,false,true,true,clear,false,1,Arrive at the HERTZ location on Wednesday morning at 9 AM,low,The customer only needed to provide personal information and confirm the pickup time.,finalized
audiofile-686588607878_extracted,complete,"6 Marlton Pike, Cherry Hill, New Jersey","The conversation is between Jennifer from HERTZ and a customer named Yvette. The call aims to update Yvette's car rental reservation, which is authorized by Progressive at the Cherry Hill branch due to her vehicle repair. Yvette is advised to have her daughter collect the rental car after transferring the reservation to her name through their insurance agent. Jennifer confirms reservation details, vehicle information, and advises Yvette to notify the branch in advance and ensure the daughter presents a valid driver’s license and a payment card.",Progressive,straight_through,completed,straight_through,flexible,choosing who would pick up the rental (Yvette vs. her daughter)|confirming details for the update,Suggested at least an hour advance notice for the branch.,Approximately 11:15 or 11:30 for the pickup.,scheduled,false,,true,false,true,false,false,false,false,false,true,true,false,true,false,false,false,,false,,,Tesla Model 3,,true,false,true,false,false,,false,false,false,,false,false,,false,false,false,,true,some_experience,false,false,false,calm,calm,false,false,false,true,false,true,true,clear,false,3,Contact insurance agent to change the reservation name.|Notify the HERTZ branch at least an hour in advance.|Ensure the daughter brings a valid driver’s license and payment card.,medium,Yvette needs to coordinate between the insurance company and her daughter.,finalized
audiofile-686588633883_extracted,complete,"O'Fallon, Missouri, at 1120 Technology Drive, Suite 111","The call was from Lyric at HERTZ to update a reservation for Natalie Lomax. State Farm had authorized a rental for an address in O'Fallon, Missouri. The call recipient indicated that it was her husband who requested the rental, and she mentioned that HERTZ had been calling her number, but her husband's number should also be available. There was uncertainty about whether the husband still needed the vehicle.",State Farm,,completed,straight_through,flexible,whom to contact for further confirmation (between the wife and the husband),,,,false,,true,false,false,false,false,false,false,false,false,true,false,false,false,false,false,,false,,,,,false,false,false,false,false,,false,false,false,,false,false,,false,false,true,who should receive rental information,,,true,false,false,calm,calm,false,false,false,false,false,true,true,clear,false,2,Give her husband the contact number for HERTZ|Have her husband call HERTZ to either confirm or update the reservation,low,The customer only needed to relay a phone number to her husband and have him make a call.,parked
audiofile-686588637827_extracted,complete,"2655 Allen Road in Woodhaven, Michigan","The conversation was between Jennifer from HERTZ and Ms. Charbonne Lyons regarding an authorized rental by Cure Insurance. Ms. Lyons needed clarification regarding her rental options as she was not comfortable driving a Kia due to a recent theft. She also required pickup service, but faced issues with contacting the branch. The agent attempted to change her location to West 8 Mile Road to avoid a Kia vehicle and promised escalation to an area manager since the branch wasn't answering calls. Ms. Lyons was told she would be contacted back regarding vehicle availability and pickup arrangements.",Cure Insurance,,parked,high_constraint_safety_sensitive,urgent,verifying the email address|confirming the unavailability of pickup|vehicle type preference related to safety concerns|changing the rental location,"Not explicitly mentioned, but agent suggested 11:45 AM for pickup depends on branch response.",Pickup at any available time on the same day.,,true,branch was unresponsive|availability of desired vehicle was unclear,,true,true,false,true,true,true,false,false,false,true,false,true,true,true,customer did not want another Kia due to past theft,true,safety,,"Preference against a Kia; accepted options include a Malibu or smaller, temporary vehicle.",,false,false,,false,false,,false,true,false,false,true,false,,false,true,false,,true,some_experience,false,false,true,anxious,stressed,true,true,true,true,true,true,true,partial,false,2,Wait for a callback|ensure availability of driver's license and payment card,medium,"due to high concern over safety, detailed need communication, waiting for branch confirmation, previous complications with locations, and emotional distress from past incidents.",parked
audiofile-686588645273_extracted,complete,"Corpus Christi, Texas, 3801 South Padre Island Drive, Suite B","The conversation involves Zariah from HERTZ contacting Skye to confirm details of a rental authorized by State Farm Insurance due to a vehicle repair. Key topics include confirming the date and time for the rental, personal contact details, and instructions for contacting the branch. Skye plans to be dropped off by her husband at the HERTZ location.",State Farm Insurance,straight_through,completed,straight_through,flexible,confirmation of details|instructions for proceeding,,Wednesday around 3:30 PM,,false,,true,false,false,false,false,false,false,false,true,false,false,true,false,false,false,,false,,,,,true,false,true,false,false,,false,false,false,,false,false,,false,false,false,,true,some_experience,false,false,false,calm,calm,false,false,false,true,true,true,true,clear,false,2,Call the HERTZ location within the hour of pick-up.|Present valid driver's license and payment card at pick-up.,low,The process was straightforward and clearly outlined with minimal effort needed from the customer post-call.,finalized
audiofile-686588649877_extracted,complete,"Cedar Falls, Iowa","The call is between a HERTZ representative named Lyric and a customer, Darren Oppmann. State Farm has authorized a rental from HERTZ for Darren at the Cedar Falls, Iowa location. Darren mentions he needs to get an estimate for his vehicle repair before knowing when he'll need the rental. Details such as Darren's email, vehicle make and model, and repair shop are confirmed. The representative updates Darren's reservation and instructs him to contact the local branch an hour before pickup. The call concludes with basic thank yous and confirmations.",State Farm,scheduled_future,completed,Scheduled_future,flexible,,,,unsure,false,,true,false,true,false,false,false,false,false,true,true,false,true,false,false,false,,false,,,,,true,false,true,false,false,,true,false,false,,false,false,,false,false,false,,true,some_experience,false,false,false,calm,calm,false,false,false,false,false,true,true,clear,false,1,Contact the local branch with details of the repair schedule an hour before pickup.,low,Next steps were clearly laid out and dependent on external factors (the repair estimate).,finalized
audiofile-686588652209_extracted,complete,"255 Andover Street, Peabody, Massachusetts","The conversation between the customer, Ms. Carter, and the agent from HERTZ, Jennifer, involves the arrangement of a rental vehicle authorized by Travelers Insurance. Ms. Carter confirms she will drive to the Peabody location for pickup, originally requesting a 5 p.m. pickup before agreeing to 4 p.m. after being informed of the closing time. She requests a regular size SUV and is instructed to call the branch for confirmation before arrival.",Travelers Insurance,,completed,straight_through,flexible,arrival time adjustment from 5 p.m. to 4 p.m.|vehicle selection (regular size SUV),"Branch closes at 5 p.m., latest pickup at 4 p.m.","Later in the day, initially at 5 p.m.",near_term,false,,true,false,true,false,true,false,false,false,true,true,true,true,true,true,false,,false,,suv_regular,Regular size SUV,$30 per day,true,true,true,false,false,,false,false,false,,false,false,,false,false,false,,true,experienced,true,false,false,stressed,calm,false,false,false,true,true,true,true,clear,false,3,Call the Peabody location with at least one hour's notice before her visit.|Select option five on the phone system for vehicle confirmation.|Ensure she has a valid driver’s license and credit/debit card available at pickup.,low,"The customer needs to make a single phone call and ensure she has necessary documents, which is standard procedure.",finalized
