audiofile-686588954842_extracted,complete,"4945 South Peoria Avenue, Oklahoma 74105","The conversation was initiated by LaToya from HERTZ to inform Marquise Beauchamp that Farmer Insurance has authorized a replacement vehicle rental at HERTZ. After confirming details about the damaged vehicle and the repair shop, LaToya explained the steps Marquise needs to follow, including arranging pickup service and providing a valid credit or debit card. Marquise mentioned he needs someone with a credit card to assist and was informed that he would need to call the branch to arrange for pickup. The call concluded with Marquise needing to call Farmer Insurance and the local HERTZ branch to finalize details.",Farmer Insurance,scheduled_future,completed,scheduled_future,flexible,"Initial reception issues, requiring adjustment.|Decision on pickup service based on branch closing times.|Issue with needing a credit card in Marquise's name.|Instructions to call the insurance to change the pickup person's name.|Coordination with the local branch for the actual pickup.",Branch closes at 4 p.m.; latest pickup arrangement at 3 p.m. with one-hour notice required.,"Pickup today, possible tomorrow if not feasible.",near_term,false,,true,false,true,false,false,false,false,false,true,true,true,false,false,false,false,,false,,,replacement for a Chevy Express Van,,true,false,true,false,true,,true,false,false,,false,false,,false,true,true,pickup service,true,some_experience,false,true,false,calm,anxious,false,false,false,true,true,true,true,clear,false,3,Call Farmer Insurance to change pickup person's name.|Call local HERTZ branch and press option 5 to coordinate pickup.|Arrange possession of a credit/debit card in their name or a related party's name.,medium,"Due to the requirement to make additional phone calls to insurance and branch, and arrange for someone with a credit/debit card.",provisional
audiofile-686588955554_extracted,complete,"978 Highland Circle in Conyers, Georgia","The call involves a HERTZ representative, TK, calling Timothy Brown regarding a rental vehicle authorized by State Farm. Timothy confirms understanding and is heading to pick it up from the Conyers, Georgia location. He queries the discrepancy between the initially stated 34-day rental period and the now 21-day approval, which the agent advises discussing with State Farm. Details for confirmation are exchanged (email and contact number). Timothy will collect the vehicle from the branch, providing necessary identification and payment details.",State Farm,straight_through,completed,Straight_through,urgent,,,Immediate,immediate_same_day,false,,true,false,false,false,false,false,false,false,false,false,true,true,false,false,false,,false,,,,21 days,false,true,true,false,false,,true,false,false,,false,false,,false,false,true,rental period discrepancy,true,some_experience,false,false,false,calm,calm,false,false,false,true,true,true,true,clear,false,3,Go to branch to pick up vehicle|Present valid driver's license|Provide major debit or credit card,low,,finalized
audiofile-686588960184_extracted,complete,"1026 Finley Street, Portsmouth, Ohio","The call was from a HERTZ agent, Kami, to Shirley Lyles, informing her that State Farm had authorized a rental for her at the Portsmouth, Ohio location. The agent offered to arrange a pickup, but Shirley expressed dizziness and a need to lay down due to recent open-heart surgery. Shirley inquired about the possibility of having the car delivered, which the agent said would depend on staffing at the Portsmouth location. The conversation ended with a plan for Shirley or her son to call back in a couple of hours to check if delivery is possible.",State Farm,scheduled_future,parked,Scheduled future,flexible,whether pickup or delivery was needed|if the delivery could be arranged based on staffing,,Approx. 2 hours from the call.,near_term,true,,true,false,true,true,false,false,true,true,true,false,true,false,false,false,false,Shirley's recent open-heart surgery and potential medical needs.,true,medical,,,,false,false,false,false,false,,false,false,false,,false,false,,false,false,true,delivery availability,true,some_experience,false,false,true,anxious,calm,false,true,true,true,true,true,true,clear,false,2,call back in a couple of hours to confirm delivery possibility|coordinate through her son for further communication,medium,Shirley and her son need to do additional follow-ups to confirm delivery based on staffing.,parked
audiofile-686588970328_extracted,complete,"11723 I-35 Bruntage Road, San Antonio, Texas","The conversation involves a representative from HERTZ confirming details with Mr. Garcia regarding a vehicle rental authorized by State Farm. Mr. Garcia is to pick up the vehicle from the San Antonio location as part of an insurance replacement arrangement. Key topics include confirming the branch location, arranging pickup details, setting a reservation time, confirming contact information, and discussing payment details for a security deposit which will be reimbursed. Mr. Garcia is instructed to call the branch an hour before his appointment to confirm vehicle readiness. The transaction is planned and confirmed with no resolution issues.",State Farm,straight_through,completed,straight_through,flexible,minor hesitation when confirming location details,Call the branch an hour before the scheduled time at 3 PM to confirm vehicle readiness.,Today at 4 PM.,immediate_same_day,false,,true,false,false,false,false,false,true,false,true,true,true,true,false,false,false,,false,,,,,true,false,true,false,false,,true,false,false,,false,false,,false,false,true,minor confusion about the address,true,some_experience,true,false,false,stressed,calm,false,false,false,true,true,true,true,clear,false,2,Ensure possession of a valid driver’s license and a major credit/debit card.|Call the designated branch an hour before the appointment.,low,"The customer needs to make a call and prepare standard documentation, both straightforward tasks.",finalized
audiofile-686588971817_extracted,complete,"783 Bell Road in Antioch, Tennessee","The agent, Latoya from HERTZ, called the customer, Mia Mina, to finalize a rental vehicle reservation authorized by State Farm. Mia verified her contact information and indicated that she could get a ride to the HERTZ location. She needed the rental by 2 PM, ideally. Latoya informed Mia to provide at least one-hour notice by calling the branch directly and discussed the types of vehicle Mia would need due to her family's needs. Insurance coverage up to $50/day, totaling $1,500, was discussed. The call was concluded with the agent providing steps for the next actions.",State Farm,straight_through,completed,Straight_through,urgent,customer's transportation to the location|vehicle class requirement,At least one hour advance notice required,By 2 PM,scheduled,false,,true,false,false,false,false,false,false,false,true,false,false,true,false,false,false,space needed for two bulky car seats,true,safety,special,Midsize vehicle or comparable SUV,"$50/day up to $1,500",true,true,true,false,false,,false,false,false,,false,false,,false,false,true,phone numbers,true,some_experience,false,false,false,calm,calm,false,false,false,true,true,true,true,clear,false,2,Call the branch with at least one-hour advance notice|Provide a driver's license and card at pickup,low,"because instructions were clear, and the process was straightforward.",finalized
audiofile-686588982074_extracted,complete,"5714 Loop 410 West Suite 400 in San Antonio, Texas","The call was from TK at HERTZ to Scott Walker, informing him about an authorized HERTZ vehicle by State Farm. The customer, Scott, is planning to take his truck for an estimate on repairs due to hail damage. He mentions needing the vehicle up to Thanksgiving and that the truck is still drivable. Scott indicates that he will call back to schedule the rental once ready. His contact and vehicle information were confirmed, and the customer was thanked, with the call concluding smoothly.",State Farm,scheduled_future,completed,scheduled_future,flexible,,,The customer intends to keep the truck through around Thanksgiving.,no_urgency,false,,true,false,false,false,false,false,false,false,false,false,false,,false,false,false,,false,,,,,false,false,false,false,false,,false,false,false,,false,false,,false,false,false,,true,some_experience,false,false,false,calm,calm,false,false,false,true,true,true,true,clear,false,2,The customer plans to go into town for a repair estimate|will call back when ready,low,"The customer only needs to call back to schedule the rental when ready, with no immediate actions required.",provisional
audiofile-686588984772_extracted,complete,"3801 South Padre Island Drive, Suite B in Corpus Christi, Texas",The call is from Latoya at HERTZ to Cheryl Longwell regarding a State Farm authorized replacement vehicle. Cheryl is near the HERTZ location and provides vehicle details and her repair shop's location. An SUV is requested for rental. The agent confirms the reservation and instructs Cheryl to present a valid driver's license and payment card. Cheryl's email address is collected for reservation confirmation. The call ends with all requirements met and the reservation ready for Cheryl to pick up.,State Farm,straight_through,completed,The call is about a State Farm authorized replacement vehicle.,flexible,Correction of vehicle year,,The customer was already near the location.,immediate_same_day,false,,true,false,false,false,false,false,false,false,false,false,false,true,false,false,false,,false,,suv_regular,SUV,,true,false,true,false,false,,false,false,false,,false,false,,false,false,false,,true,some_experience,false,true,false,calm,calm,false,false,false,false,true,true,true,clear,false,3,Go to the HERTZ location.|Present a valid driver's license and a payment card.|Check email for confirmation details.,low,"The customer had to provide minimal information and was already at the branch location, making the process straightforward.",finalized
audiofile-686588996942_extracted,complete,"27452 Jefferson Avenue, Suite Number 4 in Temecula, California","The conversation was between a HERTZ representative and a customer, Alejandro Alvara Rodriguez, regarding a vehicle rental authorized by State Farm. The representative inquired if Alejandro needed a pickup service for the rental from the Temecula branch. Alejandro mentioned exploring different body shops and contemplating another rental location closer to the potential body shop. He gave a zip code for the representative to find a closer HERTZ location, which turned out to be in San Diego. Alejandro was unsure about the body shop's location and opted to call back once he decides. The representative confirmed Alejandro's contact information and provided a customer service number for future inquiries. The call concluded without finalizing a rental pickup or delivery schedule.",State Farm,parked_waiting_on_third_party,parked,Parked_waiting_on_third_party,flexible,whether Alejandro needed a pickup service|deciding the body shop location|finalizing the rental car location,,,no_urgency,false,,true,false,false,false,false,false,true,,true,false,,,false,false,false,,false,,,,,false,false,false,false,false,,false,false,false,,false,false,,false,false,true,purpose of the pickup,true,some_experience,true,false,false,calm,calm,false,false,false,true,true,true,true,clear,false,2,Call back with final decision on body shop/location|Await email confirmation,medium,"Alejandro needs to finalize body shop locations and follow up to amend the rental location, involving multiple steps but not complex processes.",parked
audiofile-686589009072_extracted,complete,"1400 South I-35 East in Louisville, Texas, 75067","LaToya from HERTZ calls Katina Jackson to finalize a rental reservation authorized by Elephant Insurance. They confirm personal details and discuss vehicle options, where Katina chooses a midsize SUV, even though it exceeds the insurance coverage. The call concludes with instructions for Katina to contact the Louisville branch.",Elephant Insurance,,completed,straight_through,urgent,pickup service need|type of vehicle chosen|agreeable excess charge for SUV,,Today at 4 p.m.,immediate_same_day,false,,true,false,false,false,false,false,false,false,true,true,false,true,false,false,false,,false,,suv_regular,midsize SUV,$30 per day,true,true,true,false,false,,false,false,false,,false,false,,false,false,true,which phone option to select,true,some_experience,true,false,false,stressed,calm,false,false,false,true,true,true,true,clear,false,3,Call the Louisville branch by 3 p.m.|use Option 5|present a driver’s license and payment method,low,"The process was well-organized with clear instructions and the customer seemed content with the outcome, showing no sign of frustration or excessive effort.",finalized
audiofile-686589009874_extracted,complete,"1501 Gaylord Trail, Grapevine, Texas","The call is between a HERTZ agent and Mr. Kim, who has been authorized a vehicle rental by State Farm due to repairs needed on his Tesla Model 3. The agent confirms the location for pickup but Mr. Kim is unsure of his mode of transport to the pickup location as he has plans with Tesla for repair work. Mr. Kim requests to call back once he verifies his plans. Contact information exchange occurs for a follow-up.",State Farm,scheduled_future,parked,scheduled_future,flexible,Mr. Kim needing to verify his plans before proceeding with rental pickup,,,,false,,true,false,false,false,false,false,true,,false,false,,,false,false,false,,false,,,,,false,false,true,false,false,,false,false,false,,false,false,,false,false,true,transportation arrangements to the rental location,true,some_experience,false,false,false,calm,calm,false,false,false,true,true,true,true,clear,false,2,Verify arrangements with Tesla regarding vehicle repair|Call back HERTZ to confirm the rental appointment,medium,"Mr. Kim has to coordinate between multiple parties (Tesla, HERTZ) to finalize logistics.",parked
audiofile-686589023130_extracted,complete,"Hertz branch at 5732 Bucky's Town, Pipe 22 in Frederick, Maryland","The customer service agent from Hertz contacted Fidelis Dinguan to confirm a State Farm-authorized rental car at Hertz's Frederick, Maryland location. Fidelis had already arrived at the branch due to a lack of pickup service. They discussed the towing of Fidelis' damaged 2014 Toyota Highlander, which was meant to be towed to Frederick Motor Company. The agent advised Fidelis to contact State Farm regarding towing. Fidelis initially confused the agent with a State Farm representative, but the confusion was clarified.",State Farm,,completed,straight_through,flexible,confirming the location|understanding the towing status|establishing who to contact regarding towing|clarifying the call's purpose,,,,false,,true,false,false,false,false,false,false,false,false,false,true,true,false,false,false,,false,,,,,false,false,false,false,false,,false,false,false,,false,false,,false,false,true,who the Hertz agent worked for,true,some_experience,false,false,false,calm,calm,false,false,false,true,true,true,true,clear,false,1,Contact State Farm regarding towing details.,low,The customer needs to make only one additional call to their insurer for details.,finalized
audiofile-686589029167_extracted,complete,"2544 North Reynolds Road in Toledo, Ohio and Ann Arbor, Michigan","The call involves Latoya from HERTZ informing Tanisha Chaudhary about a Tesla Insurance authorized replacement rental. The customer, Tanisha, insists on having a Tesla for her rental and mentions her willingness to pick it up from Michigan if needed. The agent looks into availability and finds a Tesla Model 3 in Ann Arbor, Michigan. The customer stresses needing confirmation on availability before traveling. The agent advises Tanisha to contact the Ann Arbor location directly and informs her that a confirmation email with details will be sent. The customer asks about specific vehicle features, which the agent states needs to be confirmed with the local branch. The reservation is updated, and instructions for confirmation and pickup are provided.",Tesla Insurance,straight_through,completed,"straight_through, but with decision points made dynamically",urgent,availability of the vehicle|location queries|confirmation of specific vehicle features,need to provide at least one-hour notice before arrival,,unsure,true,,true,true,true,false,false,true,true,false,true,true,true,true,false,true,true,,false,,,Tesla Model 3,,false,false,false,false,false,,false,false,false,,false,false,,false,false,true,specific features of the Tesla Model 3,true,some_experience,false,false,true,calm,anxious,false,true,false,true,true,true,true,clear,false,3,Contact Ann Arbor branch with one-hour notice and use option 5.|Prepare a valid driver's license and credit/debit card for pickup.|Confirm a pickup time with her friend.,medium,"due to the need for coordination with the branch and friend, alongside the necessity for validation and confirmation of reservation details.",finalized
audiofile-686589029502_extracted,complete,"9001 East Colonial Drive, Orlando, Florida (Greenway place)","The customer, Vickie A. Cohen, was contacted by TK from Hertz about a vehicle rental authorized by State Farm due to her car being in for repairs. The discussion involved confirming the pickup location and time, noting Vickie would self-pickup the vehicle around 11 AM on the upcoming Wednesday. TK offered to email the contact details to Vickie since she was in her car and couldn't take notes. They discussed the vehicle class, insurance covering $50/day, and confirmation procedures. The call concluded with Vickie understanding the next steps and confirming she had no further questions.",State Farm,straight_through,completed,Straight_through,flexible,clarifications needed on pricing|insurance coverage details,,Before 12 PM on the upcoming Wednesday.,scheduled,false,,true,false,true,false,false,false,false,false,true,true,false,true,false,true,false,,false,,suv_regular,SUV,$50/day,true,true,true,false,false,,false,false,false,,false,false,,false,false,true,weekly versus daily rates,true,some_experience,false,false,false,stressed,calm,false,false,false,true,true,true,true,clear,false,3,Await email with contact details.|Call the Hertz location one hour before pickup and choose option 5.|Present a valid driver's license and credit/debit card at pickup.,low,"Low effort required as the process was straightforward, with minimal action needed on the customer's part.",finalized
audiofile-686589047608_extracted,complete,"3801 S. Padre Island Dr. B in Corpus Christi, TX 78415","Latoya from Hertz calls Mr. Longoria to inform him that State Farm has authorized a Hertz insurance replacement vehicle. They discuss the process for finalizing the reservation, including Mr. Longoria's current location, the repair shop, and transportation needs. He decides to talk to the repair shop to see if they can take his truck. The agent gives instructions on calling the location directly for the rental, using option five to reach the desk, and informs him about the requirement of a driver's license and a credit or debit card. Mr. Longoria expresses the need for a truck similar to his current vehicle.",State Farm,straight_through,completed,straight_through,flexible,discussing the vehicle size|whether Mr. Longoria needed pickup service,The Hertz location requires one-hour advance notice.,Timing depended on when the repair shop could take the truck in.,unsure,false,,true,false,true,false,false,false,false,,true,true,,,false,false,false,,false,,,"A truck, similar to his current vehicle, a Toyota Tacoma.",,true,,false,false,false,,true,false,false,,false,false,,false,false,true,the exact location|process,true,some_experience,false,false,false,calm,calm,false,false,false,true,true,true,true,clear,false,3,Confirm with the repair shop if they can take his truck.|Call the Corpus Christi branch one hour in advance using option five.|Provide a valid driver's license and a credit/debit card at the branch.,medium,"requires follow-up with the repair shop and a call to the branch, but steps were clearly explained.",finalized
audiofile-686589047697_extracted,complete,"30507 Woodward Avenue in Royal Oak, Michigan","The conversation involves a representative from Hertz, identified as TK, and a customer named Shirley Warwick. The purpose is to arrange a rental car authorized by State Farm following a vehicle collision. Shirley requires a pickup from her home on Thursday at 3 PM, as the collision shop will collect her car before noon. The customer provides her contact and vehicle information, and the agent explains the financial arrangements, including a $50 deposit. Shirley is instructed to confirm the pickup an hour before her appointment by calling option 5. The conversation concludes with Shirley expressing satisfaction and no further questions.",State Farm,scheduled_future,completed,scheduled_future,flexible,confirming the pickup location|deciding on a pickup time,,"Pickup after her car is collected, around 3 PM on Thursday.",,false,,true,false,true,false,false,false,false,false,true,true,true,false,false,false,false,,false,,,,,true,false,true,false,false,$50,true,false,false,,false,false,,false,false,false,,true,,false,false,false,stressed,calm,false,false,false,true,true,true,true,clear,false,3,Be ready for pickup at 3 PM on Thursday.|Call the branch one hour prior to the scheduled pickup.|Present a valid driver's license and a major debit/credit card.,low,"Low, as arrangements were straightforward and instructions clearly communicated without any complex tasks for the customer.",finalized
audiofile-686589050905_extracted,complete,"2893 Richmond Road, Suite 130, Lexington, Kentucky","The call is initiated by Tiffany from Hertz to inform James Kester that he is authorized for an insurance replacement rental by State Farm at the Lexington, Kentucky location. James is located in Somerset and has no transportation to reach the rental branch, which is roughly 60 to 70 miles away. The rental pickup service is only available within 30 miles, leaving James without a means to access the vehicle. Tiffany suggests contacting the insurance company for possible support and notes that James is facing mobility issues and financial constraints, expressing frustration and feeling stranded. The call concludes without scheduling the rental or resolving the transportation issue.",State Farm,time_infeasible,parked,Time_infeasible,urgent,transportation feasibility|transportation assistance options,Pickup services limited to a 30-mile radius.,Immediate need as he is currently stranded.,immediate_same_day,true,distance constraints on pickup services,false,true,false,false,true,true,false,false,false,false,true,false,false,false,false,The customer mentioned being crippled and unable to walk.,true,medical,,Insurance replacement rental,,false,false,false,true,true,,false,false,false,,false,false,,false,false,false,,true,some_experience,false,false,true,frustrated,calm,false,true,false,true,true,true,true,partial,false,2,Contact the insurance company to discuss potential transportation support.|Arrange personal transportation to reach the rental location if insurance assistance is unavailable.,high,due to the complexity of arranging transport and financial constraints while managing personal mobility challenges.,parked
audiofile-686589067555_extracted,complete,"HERTZ at 10010 San Pedro Avenue, Suite 101 in San Antonio, Texas","The conversation is between a HERTZ representative and a customer named Mr. Marcos. State Farm has authorized a rental vehicle for Mr. Marcos from a specific HERTZ location in San Antonio, Texas. Mr. Marcos is waiting for information from the repair shop before scheduling a vehicle pickup and plans to call HERTZ back to finalize the arrangement.",State Farm,straight_through,parked,straight_through,flexible,When to schedule the appointment,,Waiting for repair shop information before scheduling,unsure,false,,true,false,false,false,false,false,false,false,false,false,false,,false,false,false,,false,,,,,true,false,true,false,false,,false,false,false,,false,false,,false,false,false,,true,some_experience,false,false,false,calm,calm,false,false,false,true,true,true,true,clear,false,2,Wait for repair shop details|Call HERTZ to schedule vehicle pickup,low,The customer has a simple plan to follow and there was no immediate need to act.,parked
audiofile-686589071890_extracted,complete,"5400 Lauby Road in Canton, Ohio","Tiffany from Hertz called Thomas to inform him of a State Farm authorized insurance replacement rental scheduled for pickup at Hertz's Canton, Ohio location. Thomas preferred a pickup service from home, arranged for 4 p.m. that day. There was an attempt to connect Thomas with the branch, but it was unreachable. Tiffany assured Thomas the branch would call him shortly to arrange the pickup.",State Farm,parked_waiting_on_third_party,parked,Parked_waiting_on_third_party,urgent,arranging a pickup time|verifying contact information,,4 p.m. same day,immediate_same_day,false,,true,false,true,false,false,false,false,false,true,true,true,false,false,false,false,,false,,,,,true,false,true,false,false,,true,true,true,false,true,false,,false,false,false,,true,some_experience,false,false,false,calm,calm,false,false,false,true,true,true,true,clear,false,2,Await a call from the branch for pickup arrangements|Call branch directly using option 5 if needed,low,"Most actions were taken by the agent with clear communication, and the follow-up was managed by Hertz.",parked
